{
  "$schema": "../../schemas/records/technology.schema.json",
  "schema_version": "1.0.0",
  "id": "technology.flexibus",
  "record_type": "technology",
  "data": {
    "id": "technology.flexibus",
    "name": "FlexiBUS",
    "category": "peripheral_communication_bus",
    "introduced": {
      "event_name": "NCC 1978 — Logix Aurelia launch",
      "event_start_date": "1978-06-05"
    },
    "owner": "Logix",
    "specification": {
      "communication": "serial duplex peripheral communication",
      "attachment_model": "dynamic attachment is supported when the bus is inactive",
      "device_identification": true,
      "peripheral_rom_metadata": [
        "DEVICE ID",
        "DEVICE TYPE",
        "VENDOR",
        "PROTOCOL VERSION",
        "POWER REQUIREMENTS"
      ],
      "openness": "The technical specification is published for third-party implementation.",
      "compatibility_policy": "Logix commits to forward peripheral compatibility across future Logix computer generations.",
      "implementation_design": {
        "status": "Accepted design baseline; implementation conformance and measured performance remain to be validated.",
        "title": "FlexiBUS v1 transport and driver model",
        "physical": {
          "topology": "Point-to-point host port to one device; no passive multidrop or implicit daisy chaining in v1.",
          "signaling": "Separate differential transmit and receive pairs; asynchronous serial framing.",
          "rates_bps": [
            125000,
            500000
          ],
          "startup_rate_bps": 125000,
          "cable_target": "Shielded cable up to 3 m at 500 kbit/s; qualify signal integrity and period-appropriate line components.",
          "power": "Power contacts/current limits and keyed connector pinout require an electrical drawing. Disk/printer devices self-powered; keyboard power is current-limited.",
          "attachment": "Attach or detach only while the port is quiescent. Ground-first/power sequencing must be defined; no unrestricted live hot-plug claim."
        },
        "frames": {
          "encoding": "8N1 byte transport, 0x7E delimiter and escaped delimiter/escape bytes.",
          "header": [
            "protocol version",
            "message class",
            "flags",
            "request ID",
            "payload length"
          ],
          "max_payload_bytes": 256,
          "integrity": "CRC-16-CCITT, polynomial 0x1021, init 0xFFFF, no reflection, xorout 0x0000; cover unescaped header and payload. Byte order must be frozen in wire specification.",
          "flow_control": "One outstanding request per device initially; explicit ACK/NAK, bounded timeout/retry, device BUSY and response credit."
        },
        "commands": [
          "IDENTIFY and capabilities",
          "RESET and health",
          "Keyboard event read",
          "Printer status and bounded output blocks",
          "Disk geometry/media generation, sector read/write and flush"
        ],
        "reliability": [
          "Sequence/request IDs reject duplicate execution; keep the last completed request/response until session reset.",
          "Retries of writes must carry the same identity; media changes invalidate queued requests.",
          "Disk devices buffer complete sectors locally. Host throughput need not equal raw disk bit rate.",
          "Report removal, CRC errors, timeouts and unsupported operations through stable OS errors.",
          "Reset changes the session epoch. Do not silently retry an unresolved non-idempotent operation such as print output after reset; report uncertain completion to the caller."
        ],
        "performance": "500 kbit/s with 8N1 permits at most 50 KB/s before headers, escaping and turnaround; 125 kbit/s permits at most 12.5 KB/s. Keyboard polling must not monopolize CPU during disk transfers.",
        "drivers": "Use architecture-neutral device descriptors and class protocols. Host OS provides Z80 or ERA class drivers. Optional device-specific ROM drivers must carry explicit ISA/ABI tags; never execute a Z80 ROM driver as ERA code.",
        "validation": [
          "FIFO overrun and worst-case CPU service latency",
          "Printer backpressure",
          "Disk retry after lost reply",
          "CRC faults, cable removal and power sequencing"
        ]
      },
      "keyboard_standard_ref": "technology.logix_tui_keyboard_standard",
      "ecosystem_programme": {
        "programme_file": "ncc_1979_campaign.json",
        "policy": "Non-exclusive independently branded implementations; software and video adoption are optional.",
        "class_extension_gates": "Plotter, modem and specialist profiles and drivers require design and qualification. Discovery metadata alone does not guarantee operation.",
        "governance": "DRI leads software interfaces; Logix contributes hardware specifications; independent manufacturers participate. Final charter, fees and support period remain open."
      }
    },
    "used_by": [
      "computer.aurelia",
      "computer.aurelia_plus",
      "computer.artemis",
      "device.flexiprint40",
      "device.flexidisk",
      "device.apple2_expansion_card",
      "device.flexidisk_ii",
      "device.s100_flexibus_card",
      "device.logix_mouse"
    ]
  }
}
