{
  "$schema": "../../schemas/records/technology.schema.json",
  "schema_version": "1.0.0",
  "id": "technology.logix_digital_video",
  "record_type": "technology",
  "data": {
    "id": "technology.logix_digital_video",
    "name": "Logix 4-bit digital video link",
    "category": "video_communication_standard",
    "introduced": {
      "event_name": "NCC 1978 — Logix Aurelia launch",
      "event_start_date": "1978-06-05"
    },
    "owner": "Logix",
    "specification": {
      "digital_data_width_bits": 4,
      "cable": "8 twisted pairs",
      "signals": [
        "Data0",
        "Data1",
        "Data2",
        "Data3",
        "Clock",
        "Control",
        "H-sync",
        "V-sync"
      ],
      "plus_base_or_reference_connection": true,
      "monitor_palette_control": "Baseline monitors accept vertical-retrace palette commands. From NCC June 1982, explicitly capable Color Pro monitors also accept bounded horizontal-retrace commands under technology.scanline_palette_list; do not send these to legacy monitors.",
      "control_channel": {
        "direction": "Half-duplex bidirectional Control pair",
        "implementation": "Host firmware performs selection using controller control-channel registers; monitor fixed capability ROM/straps and serializer.",
        "startup": [
          "Blank picture",
          "Read versioned capability record with integrity check and timeout",
          "Intersect host and monitor raster support",
          "Select raster and initialize palette",
          "Enable picture"
        ],
        "capability_fields": [
          "protocol version",
          "monitor ID",
          "supported raster IDs",
          "maximum pixel clock",
          "color or grayscale",
          "palette precision",
          "preferred raster",
          "integrity check"
        ],
        "failure_policy": "Use an explicitly configured profile or documented common safe raster; otherwise remain blank. Never infer 640-pixel support from connection alone.",
        "electrical_status": "External drivers/transceivers; voltage, termination, connector pinout, turnaround, timeout and packet encoding remain qualification gates. No hot-plug guarantee."
      },
      "raster_profiles": [
        {
          "id": "raster_320_200",
          "active_width": 320,
          "active_height": 200,
          "pixel_clock_mhz": 7.15909,
          "horizontal_total_pixels": 456,
          "vertical_total_lines": 262
        },
        {
          "id": "raster_640_200",
          "active_width": 640,
          "active_height": 200,
          "pixel_clock_mhz": 14.31818,
          "horizontal_total_pixels": 912,
          "vertical_total_lines": 262
        },
        {
          "id": "raster_640_400",
          "active_width": 640,
          "active_height": 400,
          "pixel_clock_mhz": 21.504,
          "horizontal_total_pixels": 800,
          "vertical_total_lines": 448,
          "horizontal_frequency_khz": 26.88,
          "frame_rate_hz": 60,
          "interlaced": false
        }
      ],
      "raster_status": "Legacy 200-line targets approximately 15.70 kHz / 59.92 Hz. Mono Pro 640×400 target 26.88 kHz / 60 Hz progressive. Porch/sync widths, polarity and analog qualification remain release gates.",
      "scaling": "Integer horizontal/vertical pixel repetition, including sprites. 160/320-wide logical modes can repeat to 320/640; 100 lines repeat to 200. Reject 640-wide graphics or 80-column text on a 320-only monitor; software viewport is a separately reported service. Artemis card repeats legacy pixels/lines to 640×400 for Mono Pro; never downscales 400 lines to an old monitor.",
      "palette_mapping": "Explicit 1-bit and 2-bit pixel-to-output-index maps. Color indices are not brightness values. On grayscale displays map RGB palette entries to luminance; Mono I direct DAC requires host index mapping.",
      "horizontal_palette_extension_ref": "technology.scanline_palette_list"
    },
    "used_by": [
      "computer.aurelia",
      "computer.aurelia_plus",
      "computer.artemis",
      "device.mono_monitor_1",
      "device.color_monitor_1",
      "device.mono_monitor_2",
      "device.color_monitor_2",
      "device.apple2_video_card",
      "device.s100_video_card",
      "device.artemis_video_card_64kb",
      "device.color_pro_14"
    ]
  }
}
